[
  {
    "name": "NestJS Boilerplate",
    "description": "Complete boilerplate for NestJS projects with Prisma ORM",
    "tech": "TypeScript",
    "url": "https://github.com/JohnyYen/NestJs-Template"
  },
  {
    "name": "FastAPI Template",
    "description": "Base template for creating fast, scalable APIs with FastAPI",
    "tech": "Python",
    "url": "https://github.com/JohnyYen/fastapi-template"
  },
  {
    "name": "Ignix Core",
    "description": "TypeScript package for building type-safe, extensible services with Result pattern and ORM-agnostic repositories",
    "tech": "TypeScript",
    "url": "https://github.com/JohnyYen/ignix-core"
  },
  {
    "name": "FastAPI Generic Scaffold",
    "description": "A fully generic FastAPI scaffold architected with Screaming Architecture and Clean Architecture, featuring an automated scaffolding script that generates complete, production-ready modules — repository, service, and API layers — out of the box. The generic core is extensible through a Builder pattern, allowing custom wrappers at any layer, making it adaptable to virtually any backend domain. Includes a customizable built-in admin panel.",
    "tech": "Python",
    "url": "https://github.com/JohnyYen/extreme-fastapi-boilerplate"
  },
  {
    "name": "hello-world-project",
    "description": "Starter template for new projects. Quick bootstrap with essential configurations and folder structure.",
    "tech": "TypeScript",
    "url": "https://github.com/JohnyYen/hello-world-project"
  }
]
